title,type,question,A,B,C,D,answer,image
BAB 9.4,radio,Apakah tujuan Malaysia menyertai Rancangan Colombo di bawah Komanwel?,Mengatasi masalah kemiskinan,memelihara alam sekitar,membantu golongan pelarian,meningkatkan kerjasama kebudayaan,A,
,radio,Apakah matlamat Persidangan Ketua-Ketua Negara Komanwel di Kuala Lumpur 1989?,menyelesaikan kes jenayah,meningkatkan perpaduan kaum,membincangkan isu antarabangsa,mempertahankan kedaulatan negara kecil,C,
,radio,Mengapakah Malaysia menentang Dasar Aparteid yg diamalkan di Afrika Selatan?,mengamalkan dasar komunis,menyokong program senjata kimia,mengamalkan diskriminasi kaum,menggalakkan sekatan perdagangan,C,
,radio,Mengapakah Malaysia menentang keras Dasar Aparteid yg diamalkan di Afrika Selatan,menyekat pertumbuhan ekonomi antarabangsa,menggalakkan perlumbaan senjata nuklear,menyalahgunakan hak asasi manusia,menimbulkan ketegangan antara kaum,C,
,radio,Apakah usaha utk menangani masalah kemiskinan dlm kalangan negara Komanwel?,Sidang Kemuncak Malaysia,Perjanjian Buku Merah,Rancangan Colombo,Mesyuarat ekonomi,C,
,radio,Apakah faedah yg diperoleh negara kita melalui Rancangan Colombo?,menangani masalah pelarian,mendapat khidmat menangani kemiskinan,memerangi kegiatan penyalahgunaan dadah,menandatangani perjanjian pertahanan bersama,B,
,radio,Mengapakah Malaysia menentang Dasar Aparteid,menangani ancaman pengganas,membantah pemerdagangan org,mempertahankan hak asasi manusia,mengurangkan aktiviti ketenteraan,C,
,radio,Mengapahkan Rancangan Colombo diperkenalkan.,menangani masalah kemiskinan,mengukuhkan sistem pertahanan,mendapatkan pengecualian cukai,memperjuangkan kebebasan asasi,A,